{
  "schema_version": "d3_schema_v1",
  "evaluation_run_id": "llm_judge_v3_uci_calibration_scoring__SAMPLE_UCI_POR",
  "record_id": "SAMPLE_UCI_POR__S-T12__task_aware_data_summarization",
  "scoring_status": "scored",
  "scoring_formula_version": "v3_uci_calibration_weighted_mean_v1_decimal_half_up",
  "subscores": {
    "faithfulness": {
      "applicability": "applicable",
      "score": 8,
      "rationale": "Judged against permitted UCI evidence (submission_series, Docs/evaluation_v2/Runs/full_208/phase8_evidence_sql/SAMPLE_UCI_POR/full_query_artifacts/SAMPLE_UCI_POR__S-T12.json, punctuality_summary, Docs/evaluation_v2/Runs/full_208/phase8_evidence_sql/SAMPLE_UCI_POR/full_query_artifacts/SAMPLE_UCI_POR__S-T12.json); score reflects whether central claims match the available result rows and deterministic checks."
    },
    "numerical_correctness": {
      "applicability": "applicable",
      "score": 8,
      "rationale": "Numeric claims were checked against embedded rows, referenced full artifacts, and derived-stat evidence where applicable."
    },
    "completeness": {
      "applicability": "applicable",
      "score": 8,
      "rationale": "Completeness reflects coverage of the task's required core outputs and whether large-result tasks were reduced to a partial or generic summary."
    },
    "task_relevance": {
      "applicability": "applicable",
      "score": 8,
      "rationale": "The explanation generally targets the supplied task and audience unless an issue notes a wrong or shifted evaluation target."
    },
    "actionability": {
      "applicability": "applicable",
      "score": 7,
      "rationale": "Recommendations are credited when tied to observed evidence and reduced when they are generic, unsupported, or impossible to act on from the supplied data."
    },
    "clarity": {
      "applicability": "applicable",
      "score": 8,
      "rationale": "The response is readable and structured, though some records use broad phrasing or overstate interpretive language."
    },
    "safety_fairness": {
      "applicability": "applicable",
      "score": 8,
      "rationale": "No protected-class decisioning was required; safety credit reflects conservative educational framing and whether claims avoid unsupported causal or deficit language."
    }
  },
  "claim_checks": [
    {
      "claim_id": "C1",
      "claim_text": "The explanation addresses the named task and uses the supplied UCI record as its evaluation target.",
      "claim_type": "task_targeting",
      "claim_scope": "core",
      "support_status": "supported",
      "evidence_refs": [
        "submission_series",
        "Docs/evaluation_v2/Runs/full_208/phase8_evidence_sql/SAMPLE_UCI_POR/full_query_artifacts/SAMPLE_UCI_POR__S-T12.json",
        "punctuality_summary",
        "Docs/evaluation_v2/Runs/full_208/phase8_evidence_sql/SAMPLE_UCI_POR/full_query_artifacts/SAMPLE_UCI_POR__S-T12.json"
      ],
      "checker_source": "llm_judge",
      "rationale": "Record SAMPLE_UCI_POR__S-T12__task_aware_data_summarization contains a usable explanation for Procrastination analysis."
    },
    {
      "claim_id": "C2",
      "claim_text": "The explanation covers the core requirement set: Identify whether late submission is systematic. | Describe the observed relationship between submission delay and score.",
      "claim_type": "requirement_coverage",
      "claim_scope": "core",
      "support_status": "supported",
      "evidence_refs": [
        "submission_series",
        "Docs/evaluation_v2/Runs/full_208/phase8_evidence_sql/SAMPLE_UCI_POR/full_query_artifacts/SAMPLE_UCI_POR__S-T12.json",
        "punctuality_summary",
        "Docs/evaluation_v2/Runs/full_208/phase8_evidence_sql/SAMPLE_UCI_POR/full_query_artifacts/SAMPLE_UCI_POR__S-T12.json"
      ],
      "checker_source": "llm_judge",
      "rationale": "At least the central required output is addressed or the no-data condition is explicitly acknowledged."
    },
    {
      "claim_id": "C3",
      "claim_text": "The explanation includes educational implications or recommendations.",
      "claim_type": "actionability",
      "claim_scope": "supporting",
      "support_status": "supported",
      "evidence_refs": [
        "submission_series",
        "Docs/evaluation_v2/Runs/full_208/phase8_evidence_sql/SAMPLE_UCI_POR/full_query_artifacts/SAMPLE_UCI_POR__S-T12.json",
        "punctuality_summary",
        "Docs/evaluation_v2/Runs/full_208/phase8_evidence_sql/SAMPLE_UCI_POR/full_query_artifacts/SAMPLE_UCI_POR__S-T12.json"
      ],
      "checker_source": "llm_judge",
      "rationale": "The recommendation is present, with quality reflected in the actionability subscore."
    }
  ],
  "errors": [],
  "error_summary": {
    "highest_error_severity": null,
    "error_count": 0,
    "count_by_severity": {
      "minor": 0,
      "major": 0,
      "critical": 0
    }
  },
  "raw_weighted_score": 7.9,
  "caps_applied": [],
  "effective_cap": null,
  "final_score_after_caps": 7.9,
  "verdict": "good",
  "invalid_reason": null
}
