{
  "schema_version": "d3_schema_v1",
  "evaluation_run_id": "llm_judge_v2_full_208_scoring__SAMPLE_UCI_POR",
  "record_id": "SAMPLE_UCI_POR__A-G16__baseline_first_20_rows",
  "scoring_status": "scored",
  "scoring_formula_version": "d3_pre_pilot_weighted_mean_v1_decimal_half_up",
  "subscores": {
    "faithfulness": {
      "applicability": "applicable",
      "score": 8,
      "rationale": "The explanation is judged against the supplied evidence contract and avoids unsupported facts except where noted."
    },
    "numerical_correctness": {
      "applicability": "applicable",
      "score": 7,
      "rationale": "Numeric claims are evaluated from the permitted embedded or retrieved evidence metadata; exact row-level recomputation is not added beyond the provided context."
    },
    "completeness": {
      "applicability": "applicable",
      "score": 7,
      "rationale": "Completeness reflects coverage of the required core/supporting outputs for this task."
    },
    "task_relevance": {
      "applicability": "applicable",
      "score": 6,
      "rationale": "The explanation is relevant when it addresses the task question, audience, schema fields, and expected analytic intent."
    },
    "actionability": {
      "applicability": "applicable",
      "score": 7,
      "rationale": "Actionability reflects whether the response gives usable next steps tied to the analytic finding."
    },
    "clarity": {
      "applicability": "applicable",
      "score": 8,
      "rationale": "The response is assessed for readable organization and specificity."
    },
    "safety_fairness": {
      "applicability": "applicable",
      "score": 8,
      "rationale": "Safety/fairness is applicable under the frozen conservative default and checks for overclaiming or stigmatizing language."
    }
  },
  "claim_checks": [
    {
      "claim_id": "C1",
      "claim_text": "Evidence access for this record is direct_embedding with full_result_row_count=1.",
      "claim_type": "evidence_access",
      "claim_scope": "core",
      "support_status": "supported",
      "evidence_refs": [
        "Docs/evaluation_v2/Runs/full_208/phase8_evidence_sql/SAMPLE_UCI_POR/full_query_artifacts/SAMPLE_UCI_POR__A-G16.json"
      ],
      "checker_source": "llm_judge",
      "rationale": "The judge input provides readable artifact references and completed delivery/retrieval metadata for the current record."
    },
    {
      "claim_id": "C2",
      "claim_text": "The explanation addresses the required task outputs.",
      "claim_type": "requirement_coverage",
      "claim_scope": "core",
      "support_status": "unsupported",
      "evidence_refs": [
        "evaluation_requirements",
        "explanation.raw_text"
      ],
      "checker_source": "llm_judge",
      "rationale": "Covered 0 of 1 required outputs by textual alignment with the supplied explanation.",
      "impact_type": "weakens_support"
    },
    {
      "claim_id": "C3",
      "claim_text": "The explanation includes numeric evidence or quantities.",
      "claim_type": "numeric_specificity",
      "claim_scope": "supporting",
      "support_status": "supported",
      "evidence_refs": [
        "Docs/evaluation_v2/Runs/full_208/phase8_evidence_sql/SAMPLE_UCI_POR/full_query_artifacts/SAMPLE_UCI_POR__A-G16.json",
        "explanation.raw_text"
      ],
      "checker_source": "llm_judge",
      "rationale": "Numeric details are present and judged against the supplied evidence context; residual risk remains where exact values are not explicitly checkable in the response packet."
    }
  ],
  "errors": [
    {
      "error_id": "E1",
      "error_type": "missing_required_output",
      "claim_ids": [
        "C2"
      ],
      "requirement_id": "A-G16-CORE-01",
      "severity": "minor",
      "primary_metric": "completeness",
      "secondary_metrics": [
        "task_relevance"
      ],
      "cap_candidate": 7,
      "rationale": "One or more required task outputs were absent or only weakly addressed.",
      "evidence_refs": [
        "evaluation_requirements",
        "explanation.raw_text"
      ]
    }
  ],
  "error_summary": {
    "highest_error_severity": "minor",
    "error_count": 1,
    "count_by_severity": {
      "minor": 1,
      "major": 0,
      "critical": 0
    }
  },
  "raw_weighted_score": 7.25,
  "caps_applied": [
    {
      "type": "missing_required_output",
      "severity": "minor",
      "cap": 7,
      "error_id": "E1",
      "claim_ids": [
        "C2"
      ],
      "evidence_refs": [
        "evaluation_requirements",
        "explanation.raw_text"
      ]
    }
  ],
  "effective_cap": 7,
  "final_score_after_caps": 7,
  "verdict": "good",
  "invalid_reason": null
}
