{
  "schema_version": "d3_schema_v1",
  "evaluation_run_id": "llm_judge_v2_full_208_scoring__SAMPLE_UCI_POR",
  "record_id": "SAMPLE_UCI_POR__A-S06__task_aware_data_summarization",
  "scoring_status": "scored",
  "scoring_formula_version": "d3_pre_pilot_weighted_mean_v1_decimal_half_up",
  "subscores": {
    "faithfulness": {
      "applicability": "applicable",
      "score": 8,
      "rationale": "The explanation is judged against the supplied evidence contract and avoids unsupported facts except where noted."
    },
    "numerical_correctness": {
      "applicability": "applicable",
      "score": 8,
      "rationale": "Numeric claims are evaluated from the permitted embedded or retrieved evidence metadata; exact row-level recomputation is not added beyond the provided context."
    },
    "completeness": {
      "applicability": "applicable",
      "score": 10,
      "rationale": "Completeness reflects coverage of the required core/supporting outputs for this task."
    },
    "task_relevance": {
      "applicability": "applicable",
      "score": 10,
      "rationale": "The explanation is relevant when it addresses the task question, audience, schema fields, and expected analytic intent."
    },
    "actionability": {
      "applicability": "applicable",
      "score": 8,
      "rationale": "Actionability reflects whether the response gives usable next steps tied to the analytic finding."
    },
    "clarity": {
      "applicability": "applicable",
      "score": 8,
      "rationale": "The response is assessed for readable organization and specificity."
    },
    "safety_fairness": {
      "applicability": "applicable",
      "score": 8,
      "rationale": "Safety/fairness is applicable under the frozen conservative default and checks for overclaiming or stigmatizing language."
    }
  },
  "claim_checks": [
    {
      "claim_id": "C1",
      "claim_text": "Evidence access for this record is direct_embedding with full_result_row_count=3.",
      "claim_type": "evidence_access",
      "claim_scope": "core",
      "support_status": "supported",
      "evidence_refs": [
        "Docs/evaluation_v2/Runs/full_208/phase8_evidence_sql/SAMPLE_UCI_POR/full_query_artifacts/SAMPLE_UCI_POR__A-S06.json"
      ],
      "checker_source": "llm_judge",
      "rationale": "The judge input provides readable artifact references and completed delivery/retrieval metadata for the current record."
    },
    {
      "claim_id": "C2",
      "claim_text": "The explanation addresses the required task outputs.",
      "claim_type": "requirement_coverage",
      "claim_scope": "core",
      "support_status": "supported",
      "evidence_refs": [
        "evaluation_requirements",
        "explanation.raw_text"
      ],
      "checker_source": "llm_judge",
      "rationale": "Covered 3 of 3 required outputs by textual alignment with the supplied explanation."
    },
    {
      "claim_id": "C3",
      "claim_text": "The explanation includes numeric evidence or quantities.",
      "claim_type": "numeric_specificity",
      "claim_scope": "supporting",
      "support_status": "supported",
      "evidence_refs": [
        "Docs/evaluation_v2/Runs/full_208/phase8_evidence_sql/SAMPLE_UCI_POR/full_query_artifacts/SAMPLE_UCI_POR__A-S06.json",
        "explanation.raw_text"
      ],
      "checker_source": "llm_judge",
      "rationale": "Numeric details are present and judged against the supplied evidence context; residual risk remains where exact values are not explicitly checkable in the response packet."
    }
  ],
  "errors": [],
  "error_summary": {
    "highest_error_severity": null,
    "error_count": 0,
    "count_by_severity": {
      "minor": 0,
      "major": 0,
      "critical": 0
    }
  },
  "raw_weighted_score": 8.6,
  "caps_applied": [],
  "effective_cap": null,
  "final_score_after_caps": 8.6,
  "verdict": "excellent",
  "invalid_reason": null
}
